{"leaf_order":["axle.json","controls.json","institutional.json","risk.json"],"leaves":[{"digests":{"blake3":"aa023da942fc37356ca8504f88d32ed3b2e7493875011777a72c081d4474b2c1","sha256":"9ce038a7f4b1664741c9b78a25dbb1648a87f6d13f1c2dcb308eb5ea046f8090"},"logical_path":"axle.json"},{"digests":{"blake3":"7d5195ebc6e491b29cec6feb51ff21869002bf14a24348f1d47782d296f5b290","sha256":"adf704b232c2d8ca6f16c3147d9f9bdb08bc0113eb4a1c344110d8e9257d42ff"},"logical_path":"controls.json"},{"digests":{"blake3":"4edd016bcac50095423e86109f5978c7c4b27da4bc7fce6be6c94fccacd98e45","sha256":"374daa864090d29e5758f501a9d3c7300434dbdb617f1e3d4d3c3ab37fd44105"},"logical_path":"institutional.json"},{"digests":{"blake3":"388514d7635c36c4f5650c254c8691d0667d8e710df651e9b638775954c5b1ed","sha256":"853a31ecc2c9421d0311ff19d4609b266394c7848de93ecb731157b64d4f5bd8"},"logical_path":"risk.json"}],"schema_version":"v0","trees":{"blake3":{"algorithm":"blake3","levels":[{"level":0,"nodes":["aa023da942fc37356ca8504f88d32ed3b2e7493875011777a72c081d4474b2c1","7d5195ebc6e491b29cec6feb51ff21869002bf14a24348f1d47782d296f5b290","4edd016bcac50095423e86109f5978c7c4b27da4bc7fce6be6c94fccacd98e45","388514d7635c36c4f5650c254c8691d0667d8e710df651e9b638775954c5b1ed"]},{"level":1,"nodes":["242e63a0dc7f2efed709d7e49e06c8cc03e9e2bb333c58de276038f10ad3172c","82fd1818b211856244ffdc5449fc7a705f17d5f0612a01779c57d26d59f30174"]},{"level":2,"nodes":["699463cfef5d0e549dbe2a54fdf3d249212e0863d489eda3c70b2a6d643501eb"]}],"root":"699463cfef5d0e549dbe2a54fdf3d249212e0863d489eda3c70b2a6d643501eb"},"sha256":{"algorithm":"sha256","levels":[{"level":0,"nodes":["9ce038a7f4b1664741c9b78a25dbb1648a87f6d13f1c2dcb308eb5ea046f8090","adf704b232c2d8ca6f16c3147d9f9bdb08bc0113eb4a1c344110d8e9257d42ff","374daa864090d29e5758f501a9d3c7300434dbdb617f1e3d4d3c3ab37fd44105","853a31ecc2c9421d0311ff19d4609b266394c7848de93ecb731157b64d4f5bd8"]},{"level":1,"nodes":["426f7c536f57fee5a79368213a4449f9156281417f915eeb738061bb44848a53","858a42c67ee49c1aa0b7cbcb25fe52df025621b05b371105c8de3c1ba3ed0e56"]},{"level":2,"nodes":["d7a0f0a798863848cacd97beb423f745db3b1f861be512e3b220017fb5cf8f21"]}],"root":"d7a0f0a798863848cacd97beb423f745db3b1f861be512e3b220017fb5cf8f21"}}}