{"leaf_order":["axle.json"],"leaves":[{"digests":{"blake3":"2bfb09fa97a32d0a740928e6bab2232b0de8f75b2d30a73b9a8853f9d3d6ce27","sha256":"e41f036d3fafc5c112ed23a8b70baacc6ac7b1b7b75ec684660d4c7fc4f8c7c3"},"logical_path":"axle.json"}],"schema_version":"v0","trees":{"blake3":{"algorithm":"blake3","levels":[{"level":0,"nodes":["2bfb09fa97a32d0a740928e6bab2232b0de8f75b2d30a73b9a8853f9d3d6ce27"]}],"root":"2bfb09fa97a32d0a740928e6bab2232b0de8f75b2d30a73b9a8853f9d3d6ce27"},"sha256":{"algorithm":"sha256","levels":[{"level":0,"nodes":["e41f036d3fafc5c112ed23a8b70baacc6ac7b1b7b75ec684660d4c7fc4f8c7c3"]}],"root":"e41f036d3fafc5c112ed23a8b70baacc6ac7b1b7b75ec684660d4c7fc4f8c7c3"}}}