{"leaf_order":["axle.json"],"leaves":[{"digests":{"blake3":"0323fdb0a2fdaa74a3bb0359fb8246510435b517780e0272e4a2cc335fc70bd0","sha256":"33988081395d20fd68a963932ac0d4754d5517c5490202b561cdfa07ad0e45b7"},"logical_path":"axle.json"}],"schema_version":"v0","trees":{"blake3":{"algorithm":"blake3","levels":[{"level":0,"nodes":["0323fdb0a2fdaa74a3bb0359fb8246510435b517780e0272e4a2cc335fc70bd0"]}],"root":"0323fdb0a2fdaa74a3bb0359fb8246510435b517780e0272e4a2cc335fc70bd0"},"sha256":{"algorithm":"sha256","levels":[{"level":0,"nodes":["33988081395d20fd68a963932ac0d4754d5517c5490202b561cdfa07ad0e45b7"]}],"root":"33988081395d20fd68a963932ac0d4754d5517c5490202b561cdfa07ad0e45b7"}}}